{
  "$schema": "http://json-schema.org/draft-07/schema#",
  "$id": "common/antenna.json",
  "title": "Antenna Boss",
  "type": "object",
  "description": "This schema is sent by the DISCOS AntennaBoss component. It holds valueable info regarding the antenna pointing, the currently pointed target, as well as some other additional information.",
  "node": "antenna",
  "properties": {
    "FWHM": {
      "type": "number",
      "title": "Full Width at Half Maximum",
      "description": "Full width at half maximum of the antenna beam.",
      "unit": "degrees"
    },
    "azimuthOffset": {
      "type": "number",
      "title": "Azimuth Offset",
      "description": "Offset applied to the azimuth angle.",
      "unit": "degrees"
    },
    "correctionEnabled": {
      "type": "boolean",
      "title": "Pointing Corrections",
      "description": "Indicates whether the pointing correction is applied."
    },
    "declinationOffset": {
      "type": "number",
      "title": "Declination Offset",
      "description": "Offset applied to the declination angle.",
      "unit": "degrees"
    },
    "elevationOffset": {
      "type": "number",
      "title": "Elevation Offset",
      "description": "Offset applied to the elevation angle.",
      "unit": "degrees"
    },
    "generatorType": {
      "type": "string",
      "title": "Generator Type",
      "description": "Type of pointing generator used for tracking.",
      "enum": [
        "SIDEREAL",
        "SUN",
        "MOON",
        "SATELLITE",
        "SOLAR SYSTEM BODY",
        "OTF",
        "NONE"
      ]
    },
    "latitudeOffset": {
      "type": "number",
      "title": "Galactic Latitude Offset",
      "description": "Offset applied to the galactic latitude.",
      "unit": "degrees"
    },
    "longitudeOffset": {
      "type": "number",
      "title": "Galactic Longitude Offset",
      "description": "Offset applied to the galactic longitude.",
      "unit": "degrees"
    },
    "observedAzimuth": {
      "type": "number",
      "title": "Observed Azimuth",
      "description": "Observed azimuth angle of the antenna.",
      "unit": "degrees"
    },
    "observedDeclination": {
      "type": "string",
      "title": "Observed Declination",
      "description": "Observed declination angle of the antenna.",
      "unit": "dms"
    },
    "observedElevation": {
      "type": "number",
      "title": "Observed Elevation",
      "description": "Observed elevation angle of the antenna.",
      "unit": "degrees"
    },
    "observedGalLatitude": {
      "type": "string",
      "title": "Observed Galactic Latitude",
      "description": "Observed galactic latitude of the antenna pointing.",
      "unit": "dms"
    },
    "observedGalLongitude": {
      "type": "string",
      "title": "Observed Galactic Longitude",
      "description": "Observed galactic longitude of the antenna pointing.",
      "unit": "dms"
    },
    "observedRightAscension": {
      "type": "string",
      "title": "Observed Right Ascension",
      "description": "Observed right ascension of the antenna pointing.",
      "unit": "hms"
    },
    "pointingAzimuthCorrection": {
      "type": "number",
      "title": "Azimuth Pointing Correction",
      "description": "Computed correction for azimuth pointing.",
      "unit": "degrees"
    },
    "pointingElevationCorrection": {
      "type": "number",
      "title": "Elevation Pointing Correction",
      "description": "Computed correction for elevation pointing.",
      "unit": "degrees"
    },
    "rawAzimuth": {
      "type": "number",
      "title": "Raw Azimuth",
      "description": "Raw azimuth reading from the encoder.",
      "unit": "degrees"
    },
    "rawElevation": {
      "type": "number",
      "title": "Raw Elevation",
      "description": "Raw elevation reading from the encoder.",
      "unit": "degrees"
    },
    "refractionCorrection": {
      "type": "number",
      "title": "Refraction Pointing Correction",
      "description": "Atmospheric refraction correction applied to elevation.",
      "unit": "degrees"
    },
    "rightAscensionOffset": {
      "type": "number",
      "title": "Right Ascension Offset",
      "description": "Offset applied to right ascension.",
      "unit": "degrees"
    },
    "site": {
      "type": "object",
      "title": "Site",
      "description": "Geodetic and timing metadata for the antenna site.",
      "properties": {
        "name": {
          "type": "string",
          "title": "Site Name",
          "description": "Name of the site/observatory.",
          "enum": ["Medicina", "Noto", "SRT"]
        },
        "longitude": {
          "type": "string",
          "title": "Site Longitude",
          "description": "Longitude of the site, in degrees east of Greenwich.",
          "unit": "dms"
        },
        "latitude": {
          "type": "string",
          "title": "Site Latitude",
          "description": "Latitude of the site, in degrees north of the equator.",
          "unit": "dms"
        },
        "height": {
          "type": "number",
          "title": "Site Height",
          "description": "Geodetic height of the site above the reference ellipsoid.",
          "unit": "meters"
        },
        "xPosition": {
          "type": "number",
          "title": "ECEF X Position",
          "description": "X coordinate in the Earth-Centered Earth-Fixed (ECEF) reference frame. X=0 lies in the plane of the Greenwich meridian.",
          "unit": "meters"
        },
        "yPosition": {
          "type": "number",
          "title": "ECEF Y Position",
          "description": "Y coordinate in the ECEF frame. Y=0 lies in the plane of the meridian 90° east of Greenwich.",
          "unit": "meters"
        },
        "zPosition": {
          "type": "number",
          "title": "ECEF Z Position",
          "description": "Z coordinate in the ECEF frame. Z=0 lies in the plane of the equator.",
          "unit": "meters"
        },
        "xPolarMotion": {
          "type": "number",
          "title": "X Polar Motion",
          "description": "X component of the Earth's polar motion (xp), in arcseconds.",
          "unit": "arcseconds"
        },
        "yPolarMotion": {
          "type": "number",
          "title": "Y Polar Motion",
          "description": "Y component of the Earth's polar motion (yp), in arcseconds.",
          "unit": "arcseconds"
        },
        "gast": {
          "type": "string",
          "title": "Greenwich Apparent Sidereal Time",
          "description": "Greenwich Apparent Sidereal Time formatted as HH:MM:SS.mmm.",
          "format": "time"
        },
        "lst": {
          "type": "string",
          "title": "Local Apparent Sidereal Time",
          "description": "Local Apparent Sidereal Time formatted as HH:MM:SS.mmm.",
          "format": "time"
        },
        "DUT1": {
          "type": "number",
          "title": "DUT1",
          "description": "Difference between UT1 and UTC (DUT1 = UT1 - UTC).",
          "unit": "seconds"
        },
        "ellipsoid": {
          "type": "string",
          "title": "Ellipsoid Model",
          "description": "Geodetic reference ellipsoid used for position and height calculations.",
          "enum": ["WGS84", "GRS80", "MERIT83", "OSU91A", "SOVIET85"]
        }
      },
      "required": [
        "name",
        "longitude",
        "latitude",
        "height",
        "xPosition",
        "yPosition",
        "zPosition",
        "xPolarMotion",
        "yPolarMotion",
        "gast",
        "lst",
        "DUT1",
        "ellipsoid"
      ],
      "additionalProperties": false
    },
    "status": {
      "$ref": "../definitions/status.json"
    },
    "target": {
      "type": "object",
      "title": "Target Information",
      "description": "Properties of the currently tracked target, including catalog data and generator-computed apparent coordinates.",
      "properties": {
        "apparentAzimuth": {
          "type": "number",
          "title": "Apparent Azimuth",
          "description": "Apparent azimuth computed by the generator.",
          "unit": "degrees"
        },
        "apparentDeclination": {
          "type": "string",
          "title": "Apparent Declination",
          "description": "Apparent declination computed by the generator.",
          "unit": "dms"
        },
        "apparentElevation": {
          "type": "number",
          "title": "Apparent Elevation",
          "description": "Apparent elevation computed by the generator.",
          "unit": "degrees"
        },
        "apparentGalLatitude": {
          "type": "string",
          "title": "Apparent Galactic Latitude",
          "description": "Apparent galactic latitude computed by the generator.",
          "unit": "dms"
        },
        "apparentGalLongitude": {
          "type": "string",
          "title": "Apparent Galactic Longitude",
          "description": "Apparent galactic longitude computed by the generator.",
          "unit": "dms"
        },
        "apparentRightAscension": {
          "type": "string",
          "title": "Apparent Right Ascension",
          "description": "Apparent right ascension computed by the generator.",
          "unit": "hms"
        },
        "catalogDeclination": {
          "type": "string",
          "title": "Catalog Declination",
          "description": "J2000 catalog declination of the target.",
          "unit": "dms"
        },
        "catalogRightAscension": {
          "type": "string",
          "title": "Catalog Right Ascension",
          "description": "J2000 catalog right ascension of the target.",
          "unit": "hms"
        },
        "flux": {
          "type": "number",
          "title": "Flux",
          "description": "Flux density of the target.",
          "unit": "Jansky"
        },
        "julianEpoch": {
          "type": "number",
          "title": "Julian Epoch",
          "description": "Julian Epoch used for target calculations."
        },
        "name": {
          "type": "string",
          "title": "Target Name",
          "description": "Identifier or name of the currently observed target."
        },
        "parallacticAngle": {
          "type": "number",
          "title": "Parallactic Angle",
          "description": "Current parallactic angle.",
          "unit": "degrees"
        },
        "radialVelocity": {
          "type": "number",
          "title": "Radial Velocity",
          "description": "Radial velocity of the target.",
          "unit": "km/s"
        },
        "radialVelocityDefinition": {
          "type": "string",
          "title": "Radial Velocity Definition",
          "description": "Radial velocity definition of the target.",
          "enum": [
            "RADIO",
            "OPTICAL",
            "REDSHIFT",
            "UNDEFINED"
          ]
        },
        "radialVelocityFrame": {
          "type": "string",
          "title": "Radial Velocity Reference Frame",
          "description": "Reference frame used for the target radial velocity measurements.",
          "enum": [
            "TOPOCENTRIC",
            "BARYCENTRIC",
            "KINEMATIC LOCAL STANDARD OF REST",
            "DYNAMIC LOCAL STANDARD OF REST",
            "GALACTIC CENTER",
            "LOCAL GROUP",
            "UNDEFINED"
          ]
        }
      },
      "required": [
        "apparentAzimuth",
        "apparentDeclination",
        "apparentElevation",
        "apparentGalLatitude",
        "apparentGalLongitude",
        "apparentRightAscension",
        "catalogDeclination",
        "catalogRightAscension",
        "flux",
        "julianEpoch",
        "name",
        "parallacticAngle",
        "radialVelocity",
        "radialVelocityDefinition",
        "radialVelocityFrame"
      ]
    },
    "timestamp": {
      "$ref": "../definitions/timestamp.json"
    },
    "tracking": {
      "type": "boolean",
      "title": "Tracking Flag",
      "description": "Indicates whether the antenna is tracking the given coordinates."
    },
    "waveLength": {
      "type": "number",
      "title": "Observation Wavelength",
      "description": "Currently used wavelength.",
      "unit": "meters"
    }
  },
  "required": [
    "FWHM",
    "azimuthOffset",
    "correctionEnabled",
    "declinationOffset",
    "elevationOffset",
    "generatorType",
    "latitudeOffset",
    "longitudeOffset",
    "observedAzimuth",
    "observedDeclination",
    "observedElevation",
    "observedGalLatitude",
    "observedGalLongitude",
    "observedRightAscension",
    "pointingAzimuthCorrection",
    "pointingElevationCorrection",
    "rawAzimuth",
    "rawElevation",
    "refractionCorrection",
    "rightAscensionOffset",
    "site",
    "status",
    "target",
    "timestamp",
    "tracking",
    "waveLength"
  ],
  "additionalProperties": false
}
