{"FWHM":0.012389297379652888,"azimuthOffset":0.0,"correctionEnabled":true,"declinationOffset":0.0,"elevationOffset":0.0,"generatorType":"SIDEREAL","latitudeOffset":0.0,"longitudeOffset":0.0,"observedAzimuth":37.180069496300824,"observedDeclination":"61:52:27.129","observedElevation":42.42075013494604,"observedGalLatitude":"01:03:54.248","observedGalLongitude":"133:56:51.507","observedRightAscension":"02:27:04.125","pointingAzimuthCorrection":-2.2897404963007992,"pointingElevationCorrection":0.13905472728890966,"rawAzimuth":394.890329,"rawElevation":42.580579,"refractionCorrection":0.02077413776504994,"rightAscensionOffset":0.0,"site":{"DUT1":0.0,"ellipsoid":"WGS84","gast":"21:04:46.339","height":700.0,"latitude":"39:29:34.000","longitude":"09:14:42.000","lst":"21:41:45.139","name":"SRT","xPolarMotion":0.0,"xPosition":4865226.971722066,"yPolarMotion":0.0,"yPosition":791916.7014386645,"zPosition":4035129.9493953995},"status":"OK","target":{"apparentAzimuth":37.180161964931294,"apparentDeclination":"61:59:39.625","apparentElevation":42.420769117741976,"apparentGalLatitude":"01:03:54.159","apparentGalLongitude":"133:56:51.356","apparentRightAscension":"02:29:01.768","catalogDeclination":"61:52:27.100","catalogRightAscension":"02:27:04.100","flux":0.0,"julianEpoch":2026.2255254374852,"name":"w3oh","parallacticAngle":-83.30656977327779,"radialVelocity":0.0,"radialVelocityDefinition":"UNDEFINED","radialVelocityFrame":"UNDEFINED"},"timestamp":{"iso8601":"2026-03-24T08:57:21.546Z","mjd":61123.37316604145,"omg_time":139936354415460000,"unix_time":1774342641.546},"tracking":true,"waveLength":0.013016344998263285}
